{
  "comparison_track": "controlled_engine",
  "contract_id": "toklet-benchmark-contract-v1",
  "energy": {
    "instrument": null,
    "joules": null,
    "scope": null
  },
  "identity": {
    "baseline_versions": {
      "llama.cpp": "3d65c90d04d337e88f2b1f7f0061f40a5324e662"
    },
    "build_flags": [
      "/Users/coloner/work/rust/toklet/artifacts/bench-tools/cmake/data/bin/cmake",
      "-S",
      "/Users/coloner/work/rust/toklet/tools/bench/llama",
      "-B",
      "/Users/coloner/work/rust/toklet/artifacts/llama-bench-build",
      "-G",
      "Ninja",
      "-DCMAKE_MAKE_PROGRAM=/Users/coloner/work/rust/toklet/artifacts/bench-tools/bin/ninja",
      "-DLLAMA_SOURCE=/Users/coloner/work/rust/toklet/artifacts/llama.cpp",
      "-DCMAKE_BUILD_TYPE=Release",
      "cmake --build --target toklet-llama-bench -j 2"
    ],
    "compiler": "Apple clang version 21.0.0 (clang-2100.1.1.101)\nTarget: arm64-apple-darwin25.6.0\nThread model: posix\nInstalledDir: /Library/Developer/CommandLineTools/usr/bin",
    "device": {
      "chip": "Apple M1 Pro",
      "name": "MacBookPro18,3",
      "os_build": "25G83",
      "os_version": "26.6.2",
      "physical_memory_bytes": 17179869184,
      "power_mode": "Now drawing from 'AC Power'\n -InternalBattery-0 (id=35586147)\t80%; AC attached; not charging present: true\nBattery Power:\n Sleep On Power Button 1\n lowpowermode         1\n standby              1\n ttyskeepawake        1\n hibernatemode        3\n powernap             1\n hibernatefile        /var/vm/sleepimage\n displaysleep         2\n womp                 0\n networkoversleep     0\n sleep                1\n lessbright           1\n tcpkeepalive         1\n disksleep            10\nAC Power:\n Sleep On Power Button 1\n lowpowermode         0\n standby              1\n ttyskeepawake        1\n hibernatemode        3\n powernap             1\n hibernatefile        /var/vm/sleepimage\n displaysleep         10\n womp                 1\n networkoversleep     0\n sleep                0\n tcpkeepalive         1\n disksleep            10",
      "thermal_conditions": "Note: No thermal warning level has been recorded\nNote: No performance warning level has been recorded\nNote: No CPU power status has been recorded"
    },
    "engine_commit": "b23795b27da7e1ccfd30b90a0f577d54cc365511",
    "model_revision": "7ae557604adf67be50417f59c2c2f167def9a775",
    "model_sha256": "fdf756fa7fcbe7404d5c60e26bff1a0c8b8aa1f72ced49e7dd0210fe288fb7fe",
    "tokenizer_revision": "7ae557604adf67be50417f59c2c2f167def9a775",
    "tokenizer_sha256": "c0382117ea329cdf097041132f6d735924b697924d6f6fc3945713e96ce87539",
    "working_tree_dirty": false
  },
  "memory": {
    "allocated_kv_bytes": 50331648,
    "engine_working_set_limit_bytes": 6442450944,
    "logical_weights_bytes": 1976131072,
    "measurement_instrument": "own-child footprint auxiliary.phys_footprint_peak; logical session allocations",
    "peak_process_bytes": 154241184,
    "scratch_bytes": null,
    "system_memory_pressure": null
  },
  "notes": [
    "Runner SHA256 6e9c30aeeefb28fb9f4c1403c537452926dcfcbf47aba394171245fb66fdbbad; binary SHA256 3a2183a32476b1d5a2edcf38694215cffdcd0cf7a9bbbc2aa087c0af5d69f962; common helper SHA256 911806d7254e905979217145b6e173ed1def09576ba3685b2c3c105176984b34; driver Python 3.12.8",
    "Admitted process estimate 5088231424 bytes; chunk 128; fixed capacity 2048; capacity rejection prompt plus requested output exceeds session capacity",
    "Model load includes any nested payload conversion. Toklet conversion includes decoding/finite checks/storage but excludes reads, allocation and final model validation; llama.cpp GGUF conversion is a separate offline phase. Source hashing warms file cache.",
    "Each cached-state preparation is completed outside request timing. Repeated input edits/reset replay from zero in this implementation.",
    "Request timer excludes admission, bounded event allocation, JSON transport, output, sampling and tokenizer. Total includes staging final pending fixed ID; first distribution comes from prefill.",
    "Unavailable system memory pressure, energy, and visible text remain null. This record does not qualify held-out quality or imply a speed ranking.",
    "Thermal report at end: Note: No thermal warning level has been recorded\nNote: No performance warning level has been recorded\nNote: No CPU power status has been recorded",
    "GGUF SHA256 a2beb1777778d38b19671981ae021cd3f405a0c79fc55a9def8c878c505f41e7; exact FP32 payload verified independently; offline conversion 7.7498848750256 seconds",
    "Worker SHA256 5d4253f705481462245d4ec98dd660b2f3521057102cde0f2ceb3c346c87be53; CMake cmake version 4.1.3\n\nCMake suite maintained and supported by Kitware (kitware.com/cmake).; Ninja 1.13.0.git.kitware.jobserver-pipe-1",
    "Metal offload requested for all layers; FP32 KV, Flash Attention disabled, one host thread; vendor diagnostics identify actual placement.",
    "Conservative admission reserves two complete GGUF copies, FP32 KV and a 1 GiB workspace allowance; scratch is unavailable.",
    "Native phys_footprint_peak is a kernel charge counter that omits clean mapped weight pages and may not fully represent shared GPU memory. Total mapped/shared physical peak is unavailable; do not interpret this small counter as the full working set or a memory advantage.",
    "On this pinned M1 implementation, kernel_mul_mm_f32_f32 uses half matrix operands with float accumulation; FP32 storage does not imply equal arithmetic. Small-batch numerical probes do not qualify the 128-token GEMM path or held-out quality.",
    "Model load starts after backend/device initialization. Initial embedded shader compilation and later lazy pipeline compilation are not separately isolated; three warmups precede samples."
  ],
  "representation": {
    "group_size": null,
    "kv_dtype": "FP32",
    "packed_format_version": null,
    "weight_dtype": "FP32"
  },
  "runtime": "llama.cpp Metal",
  "samples": [
    {
      "decode_seconds": 1.764134958,
      "emitted_tokens": 128,
      "first_visible_text_seconds": null,
      "gpu_peak_allocation_bytes": null,
      "prefill_seconds": 0.141240125,
      "process_peak_footprint_bytes": 154241184,
      "token_event_seconds": [
        0.141271083,
        0.155894,
        0.169736791,
        0.1836255,
        0.197501458,
        0.211520708,
        0.225388208,
        0.239224458,
        0.253083625,
        0.266920708,
        0.280710625,
        0.294662125,
        0.308560625,
        0.322403791,
        0.336227958,
        0.350056958,
        0.363917958,
        0.37789375,
        0.391882,
        0.405485458,
        0.418978166,
        0.432399458,
        0.445824583,
        0.459213916,
        0.472637125,
        0.486070541,
        0.499615166,
        0.513091708,
        0.526585375,
        0.540072166,
        0.553531666,
        0.566959166,
        0.580391,
        0.593868916,
        0.607768625,
        0.621776541,
        0.635806875,
        0.649925708,
        0.663881791,
        0.677843916,
        0.691557125,
        0.705507833,
        0.719460541,
        0.733410625,
        0.747393333,
        0.761347708,
        0.775272583,
        0.7892125,
        0.803193541,
        0.817158083,
        0.830960041,
        0.844895583,
        0.8587975,
        0.87265075,
        0.8865175,
        0.900414166,
        0.914328166,
        0.928221541,
        0.94222475,
        0.956138208,
        0.97007925,
        0.983998083,
        0.997808666,
        1.011723541,
        1.025686791,
        1.039634875,
        1.053567208,
        1.067541625,
        1.081472958,
        1.095384208,
        1.109256416,
        1.123203791,
        1.137181208,
        1.151135916,
        1.164992041,
        1.178945791,
        1.192932041,
        1.206779166,
        1.2206625,
        1.234556083,
        1.248640291,
        1.262730791,
        1.276809833,
        1.290995708,
        1.305208541,
        1.31929175,
        1.33316375,
        1.347113041,
        1.361106375,
        1.374999833,
        1.388916416,
        1.402796166,
        1.41687025,
        1.430657833,
        1.444764375,
        1.458711333,
        1.4726635,
        1.486637875,
        1.500541833,
        1.514368083,
        1.528437333,
        1.542347,
        1.556664958,
        1.570563666,
        1.584652375,
        1.598671833,
        1.612613666,
        1.626487416,
        1.640462291,
        1.654372833,
        1.668474583,
        1.682494833,
        1.696416791,
        1.710520541,
        1.724435125,
        1.7382655,
        1.752174291,
        1.76611975,
        1.7800875,
        1.794072833,
        1.808036,
        1.82193275,
        1.835817916,
        1.849692375,
        1.86365375,
        1.877602458,
        1.891525083,
        1.905406041
      ],
      "total_seconds": 1.905407458,
      "ttft_seconds": 0.141271083
    },
    {
      "decode_seconds": 1.766978667,
      "emitted_tokens": 128,
      "first_visible_text_seconds": null,
      "gpu_peak_allocation_bytes": null,
      "prefill_seconds": 0.142965,
      "process_peak_footprint_bytes": 154241184,
      "token_event_seconds": [
        0.142998458,
        0.157857083,
        0.1717405,
        0.185606583,
        0.199483541,
        0.2133875,
        0.227264083,
        0.2412775,
        0.255228666,
        0.269155,
        0.283063208,
        0.296928416,
        0.310909875,
        0.324889166,
        0.338856041,
        0.352827166,
        0.36681325,
        0.380693958,
        0.394573041,
        0.408543333,
        0.422430875,
        0.4364165,
        0.450377708,
        0.464327166,
        0.478203625,
        0.492099791,
        0.506030791,
        0.519924875,
        0.533881875,
        0.547793916,
        0.56167875,
        0.575635375,
        0.589536958,
        0.603470916,
        0.61743875,